{
 "employee_id": "E-20817",
 "employee": {
  "first_name": "Marisol",
  "middle_name": "Q",
  "last_name": "Fernsby",
  "ssn": "000-12-3456",
  "address": {
   "street": "72 Sample Street",
   "city": "Springfield",
   "state": "OR",
   "postal_code": "97477"
  }
 },
 "withholding": {
  "filing_status": "head_of_household",
  "two_jobs_only": false,
  "dependent_credits": 2000,
  "other_income": 1500,
  "deductions": 3200,
  "extra_withholding": 25,
  "exempt": false,
  "effective_date": "2026-02-02"
 },
 "employer": {
  "name": "Brightwater Example Foods Inc.",
  "address": {
   "street": "9 Placeholder Road",
   "city": "Eugene",
   "state": "OR",
   "postal_code": "97401"
  },
  "ein": "00-0000001"
 },
 "hire_date": "2026-01-20",
 "signed_on": "2026-01-22"
}
